taxonomy,terms
content-type,"News & Updates > Press Release, News"
content-type,"Briefs > Executive Brief, Industry Brief, Product Brief, Service Brief, Solution Brief, Technical Brief, Partner Solution Brief"
content-type,"Success Stories > Case Study, Customer Testimonial Video, Case Study Video, Partner Success Profile, Customer Story"
content-type,"eBooks & Reports > eBook, Whitepaper, Article, Analyst Report, Infographic"
content-type,"Video > Demo, Product/Service Overview, Industry, Interview"